index,item_id,shop_id,name,sold,historical_sold,liked_count,cmt_count,price,price_min,price_max,rating_star,start1,start2,start3,start4,start5,rcount_with_context,rcount_with_image
0,9311704687,134869438,"Camera Hành Trình AKASO Ống Kính Kép 3"" Ghi Hình DVR 1080P Tầm Nhìn Ban Đêm Cảm Biến G",0,12,7,4,87000000000,87000000000,87000000000,4.5,0,0,1,0,3,4,1
1,5028170842,134869438,Bộ camera hành trình AKASO cho xe hơi độ phân giải HD 1080p,0,5,5,2,60000000000,60000000000,68000000000,4.5,0,0,0,1,1,1,1
2,3183589507,134869438,Set TV Box thông minh AKASO HK1MAX Android 9.0 lõi tứ 2.4G/5G Wifi BT 4.0 DDR3 4K HDR VS X96 HK1 MINI,0,3,2,3,100000000000,100000000000,100000000000,4,0,1,0,0,2,2,1
3,4278177411,134869438,Camera Hành Trình AKASO Ống Kính Kép Màn Hình Cảm Ứng 7 Inch 1080P Quan Sát Ban Đêm Tích Hợp Gương Chiếu Hậu Cho Xe Hơi,0,7,10,2,100000000000,100000000000,100000000000,3.5,0,1,0,0,1,1,0
4,9212212046,134869438,TV Box AKASO H10 MAX Android 10.0 WIFI 4+ 32/64GB lõi tứ HD,0,1,2,0,100000000000,100000000000,100000000000,0,0,0,0,0,0,0,0
